{
  "$schema": "https://json-schema.org/draft/2020-12/schema",
  "$id": "https://podcast-scraper.dev/schemas/kg.schema.json",
  "title": "Knowledge Graph Layer Episode Artifact (kg.json)",
  "description": "Per-episode KG: nodes (Podcast/Episode/Person/Organization/Object/Topic — Entity retained as legacy), topics, and typed edges (separate from gi.json). v2.1 (#2057): Object node, the catch-all kind — an entity that is neither a person nor an organization is no longer coerced into Person; v2.0 (RFC-097): Person/Organization/Podcast first-class + HAS_EPISODE + edge_class metadata; v1.2: entity `kind` person|org; v1.1: optional descriptions; v1.0: legacy `entity_kind`. See docs/architecture/corpus/ontology.md (v2 source of truth).",
  "type": "object",
  "additionalProperties": false,
  "required": ["schema_version", "episode_id", "extraction", "nodes", "edges"],
  "properties": {
    "schema_version": {
      "type": "string",
      "pattern": "^(1\\.(0|1|2)|2\\.(0|1))$",
      "description": "KG artifact schema version (1.0 legacy, 1.1 descriptions, 1.2 canonical kind + person:/org: ids, 2.0 RFC-097 unified ontology — Person/Org/Podcast first-class + HAS_EPISODE + edge_class, 2.1 Object node — catch-all for named non-person non-organization referents, #2057)"
    },
    "episode_id": {
      "type": "string",
      "minLength": 1,
      "description": "Episode identifier (pipeline episode id)"
    },
    "extraction": {
      "type": "object",
      "additionalProperties": false,
      "required": ["model_version", "extracted_at", "transcript_ref"],
      "properties": {
        "model_version": {
          "description": "Extraction tier: `metadata_only` (episode + pipeline hosts/guests, no LLM, a deliberate reduced mode), `no_extractor` (ADR-156 / #2164 — no extraction provider produced topics, which is a MISCONFIGURATION and is kept distinct from metadata_only so the accident stays readable), `provider:<model>` (transcript LLM), or `provider:summary_bullets:<model>` (LLM from summary bullets only); see docs/architecture/corpus/ontology.md § Provenance. Accepted for already-written artifacts and NO LONGER PRODUCIBLE: `stub` (pre-#1657 name for `metadata_only`) and `summary_bullets` (the bullets-as-topics fallback ADR-156 removed — bullets are prose, not subjects).",
          "oneOf": [
            { "const": "metadata_only" },
            { "const": "no_extractor" },
            { "const": "stub" },
            { "const": "summary_bullets" },
            { "type": "string", "pattern": "^provider:.+" }
          ]
        },
        "extracted_at": {
          "type": "string",
          "minLength": 1,
          "description": "ISO 8601 timestamp when extraction ran"
        },
        "transcript_ref": {
          "type": "string",
          "minLength": 1,
          "description": "Relative path or label for transcript source"
        }
      }
    },
    "nodes": {
      "type": "array",
      "items": { "$ref": "#/$defs/node" },
      "description": "Graph nodes for this episode"
    },
    "edges": {
      "type": "array",
      "items": { "$ref": "#/$defs/edge" },
      "description": "Directed edges between nodes"
    }
  },
  "$defs": {
    "node": {
      "oneOf": [
        { "$ref": "#/$defs/podcast_node" },
        { "$ref": "#/$defs/episode_node" },
        { "$ref": "#/$defs/person_node" },
        { "$ref": "#/$defs/organization_node" },
        { "$ref": "#/$defs/object_node" },
        { "$ref": "#/$defs/topic_node" }
      ]
    },
    "podcast_node": {
      "type": "object",
      "additionalProperties": false,
      "required": ["id", "type", "properties"],
      "description": "v2.0 (RFC-097): first-class Podcast node. Source of HAS_EPISODE edges to Episode nodes.",
      "properties": {
        "id": { "type": "string", "minLength": 1, "description": "podcast:{slug}" },
        "type": { "const": "Podcast" },
        "properties": {
          "type": "object",
          "additionalProperties": false,
          "required": ["title"],
          "properties": {
            "title": { "type": "string", "minLength": 1 },
            "rss_url": { "type": "string" },
            "publisher": { "type": "string" }
          }
        },
        "confidence": { "type": "number", "minimum": 0, "maximum": 1 }
      }
    },
    "person_node": {
      "type": "object",
      "additionalProperties": false,
      "required": ["id", "type", "properties"],
      "description": "v2.0 (RFC-097): first-class Person node replacing legacy Entity(kind=person). Id: person:{slug}.",
      "properties": {
        "id": { "type": "string", "minLength": 1, "description": "person:{slug}" },
        "type": { "const": "Person" },
        "properties": {
          "type": "object",
          "additionalProperties": false,
          "required": ["name"],
          "properties": {
            "name": { "type": "string", "minLength": 1 },
            "label": { "type": "string", "minLength": 1 },
            "aliases": { "type": "array", "items": { "type": "string" } },
            "role": {
              "type": "string",
              "enum": ["host", "guest", "mentioned"],
              "description": "Pipeline role for this Person (hosts/guests from speaker pipeline, or `mentioned` for LLM-extracted)."
            },
            "description": {
              "type": "string",
              "maxLength": 4000,
              "description": "Optional 1-3 sentence episode-specific context."
            }
          }
        },
        "confidence": { "type": "number", "minimum": 0, "maximum": 1 }
      }
    },
    "organization_node": {
      "type": "object",
      "additionalProperties": false,
      "required": ["id", "type", "properties"],
      "description": "v2.0 (RFC-097): first-class Organization node replacing legacy Entity(kind=org). Id: org:{slug}.",
      "properties": {
        "id": { "type": "string", "minLength": 1, "description": "org:{slug}" },
        "type": { "const": "Organization" },
        "properties": {
          "type": "object",
          "additionalProperties": false,
          "required": ["name"],
          "properties": {
            "name": { "type": "string", "minLength": 1 },
            "label": { "type": "string", "minLength": 1 },
            "aliases": { "type": "array", "items": { "type": "string" } },
            "role": {
              "type": "string",
              "enum": ["mentioned"],
              "description": "Pipeline role for this Organization (typically `mentioned`)."
            },
            "description": {
              "type": "string",
              "maxLength": 4000,
              "description": "Optional 1-3 sentence episode-specific context."
            }
          }
        },
        "confidence": { "type": "number", "minimum": 0, "maximum": 1 }
      }
    },
    "object_node": {
      "type": "object",
      "additionalProperties": false,
      "required": ["id", "type", "properties"],
      "description": "v2.1 (#2057): first-class Object node — a NAMED THING that is neither a person nor a body of people: an event, place, creative work, product, podcast, book or standard. Also the catch-all for an entity whose kind the extractor omitted or gave outside the vocabulary; before this type existed those became Person, which is how an 11th-century event, two podcasts and three organisations occupied Person nodes in the top 40 of `top_people`. Id: object:{slug}.",
      "properties": {
        "id": { "type": "string", "minLength": 1, "description": "object:{slug}" },
        "type": { "const": "Object" },
        "properties": {
          "type": "object",
          "additionalProperties": false,
          "required": ["name"],
          "properties": {
            "name": { "type": "string", "minLength": 1 },
            "label": { "type": "string", "minLength": 1 },
            "aliases": { "type": "array", "items": { "type": "string" } },
            "role": {
              "type": "string",
              "enum": ["mentioned"],
              "description": "Pipeline role for this Object (always `mentioned` — an Object cannot host or guest)."
            },
            "description": {
              "type": "string",
              "maxLength": 4000,
              "description": "Optional 1-3 sentence episode-specific context."
            }
          }
        },
        "confidence": { "type": "number", "minimum": 0, "maximum": 1 }
      }
    },
    "episode_node": {
      "type": "object",
      "additionalProperties": false,
      "required": ["id", "type", "properties"],
      "properties": {
        "id": { "type": "string", "minLength": 1 },
        "type": { "const": "Episode" },
        "properties": {
          "type": "object",
          "additionalProperties": false,
          "required": ["podcast_id", "title", "publish_date"],
          "properties": {
            "podcast_id": { "type": "string", "minLength": 1 },
            "title": { "type": "string", "minLength": 1 },
            "publish_date": { "type": "string", "minLength": 1 },
            "audio_url": { "type": "string" },
            "duration_ms": { "type": "integer", "minimum": 0 },
            "feed_id": {
              "type": "string",
              "description": "Stable feed identifier for cross-feed graph filtering (#658). Same value as `GET /api/corpus/feeds[].feed_id`. Empty string when the pipeline can't resolve a feed."
            }
          }
        },
        "confidence": { "type": "number", "minimum": 0, "maximum": 1 }
      }
    },
    "topic_node": {
      "type": "object",
      "additionalProperties": false,
      "required": ["id", "type", "properties"],
      "properties": {
        "id": { "type": "string", "minLength": 1 },
        "type": { "const": "Topic" },
        "properties": {
          "type": "object",
          "additionalProperties": false,
          "required": ["label", "slug"],
          "properties": {
            "label": { "type": "string", "minLength": 1 },
            "slug": { "type": "string", "minLength": 1 },
            "description": {
              "type": "string",
              "maxLength": 4000,
              "description": "Optional thematic context for this topic in the episode (#487)."
            }
          }
        },
        "confidence": { "type": "number", "minimum": 0, "maximum": 1 }
      }
    },
    "edge": {
      "type": "object",
      "additionalProperties": false,
      "required": ["type", "from", "to"],
      "properties": {
        "type": {
          "type": "string",
          "enum": ["MENTIONS", "RELATED_TO", "HAS_EPISODE", "HOSTS", "GUESTS_ON"],
          "description": "Edge type. v1 builder emits **MENTIONS** (Topic|Entity → Episode). **HAS_EPISODE** (Podcast → Episode) lands in v2.0 (RFC-097). **HOSTS** / **GUESTS_ON** (Person → Podcast) make host/guest a durable per-show fact, not just a per-episode mention (#1169 host-identification Path A). **RELATED_TO** is reserved for future use (see docs/architecture/corpus/ontology.md)."
        },
        "from": { "type": "string", "minLength": 1 },
        "to": { "type": "string", "minLength": 1 },
        "properties": {
          "type": "object",
          "additionalProperties": true,
          "description": "Optional edge metadata"
        }
      }
    },
    "edge_class_metadata": {
      "description": "Non-validating schema metadata: maps each edge type to its edge_class per RFC-097 two-tier edge contract. Source of truth: docs/architecture/corpus/ontology.md. Consumed by viewer stylesheet + relational query layer + ontology contributors; never written to per-edge instances.",
      "classes": {
        "MENTIONS": "discovery",
        "RELATED_TO": "discovery",
        "HAS_EPISODE": "structural",
        "HOSTS": "structural",
        "GUESTS_ON": "structural"
      }
    }
  }
}
