{
  "edges": [
    {
      "from": "episode:254fe2be-b570-592e-84cd-c22cb9e271e9",
      "to": "topic:marine-biology",
      "type": "MENTIONS"
    },
    {
      "from": "episode:254fe2be-b570-592e-84cd-c22cb9e271e9",
      "to": "topic:reef-conservation",
      "type": "MENTIONS"
    },
    {
      "from": "episode:254fe2be-b570-592e-84cd-c22cb9e271e9",
      "to": "topic:soil-erosion",
      "type": "MENTIONS"
    },
    {
      "from": "episode:254fe2be-b570-592e-84cd-c22cb9e271e9",
      "to": "topic:outdoor-activities",
      "type": "MENTIONS"
    },
    {
      "from": "episode:254fe2be-b570-592e-84cd-c22cb9e271e9",
      "to": "topic:gear",
      "type": "MENTIONS"
    },
    {
      "from": "episode:254fe2be-b570-592e-84cd-c22cb9e271e9",
      "to": "topic:technology",
      "type": "MENTIONS"
    }
  ],
  "episode_id": "254fe2be-b570-592e-84cd-c22cb9e271e9",
  "extraction": {
    "extracted_at": "2026-09-20T12:00:00",
    "model_version": "provider:synthetic-validation-corpus-v1",
    "transcript_ref": "transcripts/p03_e02.txt"
  },
  "nodes": [
    {
      "id": "episode:254fe2be-b570-592e-84cd-c22cb9e271e9",
      "properties": {
        "podcast_id": "sha256:1f9abe36d575d2737a998280601b57b1005b188d2303f356327d3e633ca1eb4b",
        "publish_date": "2026-09-20T12:00:00",
        "title": "Below the Surface \u2014 Episode 2"
      },
      "type": "Episode"
    },
    {
      "id": "topic:marine-biology",
      "properties": {
        "label": "marine biology",
        "slug": "marine-biology"
      },
      "type": "Topic"
    },
    {
      "id": "topic:reef-conservation",
      "properties": {
        "label": "reef conservation",
        "slug": "reef-conservation"
      },
      "type": "Topic"
    },
    {
      "id": "topic:soil-erosion",
      "properties": {
        "label": "soil erosion",
        "slug": "soil-erosion"
      },
      "type": "Topic"
    },
    {
      "id": "topic:outdoor-activities",
      "properties": {
        "label": "outdoor activities",
        "slug": "outdoor-activities"
      },
      "type": "Topic"
    },
    {
      "id": "topic:gear",
      "properties": {
        "label": "gear",
        "slug": "gear"
      },
      "type": "Topic"
    },
    {
      "id": "topic:technology",
      "properties": {
        "label": "Technology",
        "slug": "technology"
      },
      "type": "Topic"
    }
  ],
  "schema_version": "2.0"
}
