{
  "edges": [
    {
      "from": "episode:ep-9b36e2e3b959298d",
      "to": "topic:visual-craft",
      "type": "MENTIONS"
    },
    {
      "from": "episode:ep-9b36e2e3b959298d",
      "to": "topic:systems-thinking",
      "type": "MENTIONS"
    },
    {
      "from": "episode:ep-9b36e2e3b959298d",
      "to": "topic:lifelong-learning",
      "type": "MENTIONS"
    },
    {
      "from": "episode:ep-9b36e2e3b959298d",
      "to": "topic:expert-interviews",
      "type": "MENTIONS"
    },
    {
      "from": "episode:ep-9b36e2e3b959298d",
      "to": "person:leo",
      "type": "MENTIONS"
    },
    {
      "from": "episode:ep-9b36e2e3b959298d",
      "to": "person:ava-lemoine",
      "type": "MENTIONS"
    }
  ],
  "episode_id": "ep-9b36e2e3b959298d",
  "extraction": {
    "extracted_at": "2025-06-21T12:00:00",
    "model_version": "provider:synthetic-validation-corpus-v1",
    "transcript_ref": "transcripts/p04_e04.txt"
  },
  "nodes": [
    {
      "id": "episode:ep-9b36e2e3b959298d",
      "properties": {
        "podcast_id": "p04",
        "publish_date": "2025-06-21T12:00:00",
        "title": "Roundtable: Three Photographers on Light"
      },
      "type": "Episode"
    },
    {
      "id": "topic:visual-craft",
      "properties": {
        "label": "visual craft",
        "slug": "visual-craft"
      },
      "type": "Topic"
    },
    {
      "id": "topic:systems-thinking",
      "properties": {
        "label": "systems thinking",
        "slug": "systems-thinking"
      },
      "type": "Topic"
    },
    {
      "id": "topic:lifelong-learning",
      "properties": {
        "label": "lifelong learning",
        "slug": "lifelong-learning"
      },
      "type": "Topic"
    },
    {
      "id": "topic:expert-interviews",
      "properties": {
        "label": "expert interviews",
        "slug": "expert-interviews"
      },
      "type": "Topic"
    },
    {
      "id": "person:leo",
      "properties": {
        "name": "Leo",
        "role": "host"
      },
      "type": "Person"
    },
    {
      "id": "person:ava-lemoine",
      "properties": {
        "name": "Ava Lemoine",
        "role": "guest"
      },
      "type": "Person"
    }
  ],
  "schema_version": "2.0"
}
