{
  "edges": [
    {
      "from": "episode:e741f35a-8dd9-5c40-9d5c-905f4dca4122",
      "to": "topic:cultural-drift",
      "type": "MENTIONS"
    },
    {
      "from": "episode:e741f35a-8dd9-5c40-9d5c-905f4dca4122",
      "to": "topic:dialogue",
      "type": "MENTIONS"
    },
    {
      "from": "episode:e741f35a-8dd9-5c40-9d5c-905f4dca4122",
      "to": "topic:long-form",
      "type": "MENTIONS"
    },
    {
      "from": "episode:e741f35a-8dd9-5c40-9d5c-905f4dca4122",
      "to": "topic:science-research",
      "type": "MENTIONS"
    }
  ],
  "episode_id": "e741f35a-8dd9-5c40-9d5c-905f4dca4122",
  "extraction": {
    "extracted_at": "2026-09-19T12:00:00",
    "model_version": "provider:synthetic-validation-corpus-v1",
    "transcript_ref": "transcripts/p06_e01.txt"
  },
  "nodes": [
    {
      "id": "episode:e741f35a-8dd9-5c40-9d5c-905f4dca4122",
      "properties": {
        "podcast_id": "sha256:c21ee2c669d9f68490326aaac0645ef2e98d795fde06720b8cbbc82428e3b6af",
        "publish_date": "2026-09-19T12:00:00",
        "title": "The Drift \u2014 Episode 1"
      },
      "type": "Episode"
    },
    {
      "id": "topic:cultural-drift",
      "properties": {
        "label": "cultural drift",
        "slug": "cultural-drift"
      },
      "type": "Topic"
    },
    {
      "id": "topic:dialogue",
      "properties": {
        "label": "dialogue",
        "slug": "dialogue"
      },
      "type": "Topic"
    },
    {
      "id": "topic:long-form",
      "properties": {
        "label": "long form",
        "slug": "long-form"
      },
      "type": "Topic"
    },
    {
      "id": "topic:science-research",
      "properties": {
        "label": "Science & research",
        "slug": "science-research"
      },
      "type": "Topic"
    }
  ],
  "schema_version": "2.0"
}
