{
  "edges": [
    {
      "from": "episode:79fb44f3-5be0-5fc7-9d43-2f39049f7f2d",
      "to": "topic:labor-markets",
      "type": "MENTIONS"
    },
    {
      "from": "episode:79fb44f3-5be0-5fc7-9d43-2f39049f7f2d",
      "to": "topic:risk-management",
      "type": "MENTIONS"
    },
    {
      "from": "episode:79fb44f3-5be0-5fc7-9d43-2f39049f7f2d",
      "to": "topic:systems-thinking",
      "type": "MENTIONS"
    },
    {
      "from": "episode:79fb44f3-5be0-5fc7-9d43-2f39049f7f2d",
      "to": "topic:technology",
      "type": "MENTIONS"
    },
    {
      "from": "episode:79fb44f3-5be0-5fc7-9d43-2f39049f7f2d",
      "to": "topic:health",
      "type": "MENTIONS"
    },
    {
      "from": "episode:79fb44f3-5be0-5fc7-9d43-2f39049f7f2d",
      "to": "topic:business-markets",
      "type": "MENTIONS"
    }
  ],
  "episode_id": "79fb44f3-5be0-5fc7-9d43-2f39049f7f2d",
  "extraction": {
    "extracted_at": "2026-09-24T12:00:00",
    "model_version": "provider:synthetic-validation-corpus-v1",
    "transcript_ref": "transcripts/p09_e03.txt"
  },
  "nodes": [
    {
      "id": "episode:79fb44f3-5be0-5fc7-9d43-2f39049f7f2d",
      "properties": {
        "podcast_id": "sha256:255b515964dcdf7f0f2123a46053fbf8c961882868ea3c88bb8ba794824c52e8",
        "publish_date": "2026-09-24T12:00:00",
        "title": "The Long View: Biohacking \u2014 Episode 3"
      },
      "type": "Episode"
    },
    {
      "id": "topic:labor-markets",
      "properties": {
        "label": "labor markets",
        "slug": "labor-markets"
      },
      "type": "Topic"
    },
    {
      "id": "topic:risk-management",
      "properties": {
        "label": "risk management",
        "slug": "risk-management"
      },
      "type": "Topic"
    },
    {
      "id": "topic:systems-thinking",
      "properties": {
        "label": "systems thinking",
        "slug": "systems-thinking"
      },
      "type": "Topic"
    },
    {
      "id": "topic:technology",
      "properties": {
        "label": "technology",
        "slug": "technology"
      },
      "type": "Topic"
    },
    {
      "id": "topic:health",
      "properties": {
        "label": "health",
        "slug": "health"
      },
      "type": "Topic"
    },
    {
      "id": "topic:business-markets",
      "properties": {
        "label": "Business & markets",
        "slug": "business-markets"
      },
      "type": "Topic"
    }
  ],
  "schema_version": "2.0"
}
