{
  "edges": [
    {
      "from": "episode:15a1cbea-1449-50ac-bb1c-11784d7421c3",
      "to": "topic:public-radio",
      "type": "MENTIONS"
    },
    {
      "from": "episode:15a1cbea-1449-50ac-bb1c-11784d7421c3",
      "to": "topic:broadcast-format",
      "type": "MENTIONS"
    },
    {
      "from": "episode:15a1cbea-1449-50ac-bb1c-11784d7421c3",
      "to": "topic:journalism",
      "type": "MENTIONS"
    },
    {
      "from": "episode:15a1cbea-1449-50ac-bb1c-11784d7421c3",
      "to": "topic:reliability",
      "type": "MENTIONS"
    },
    {
      "from": "episode:15a1cbea-1449-50ac-bb1c-11784d7421c3",
      "to": "topic:environment",
      "type": "MENTIONS"
    },
    {
      "from": "episode:15a1cbea-1449-50ac-bb1c-11784d7421c3",
      "to": "topic:technology",
      "type": "MENTIONS"
    },
    {
      "from": "episode:15a1cbea-1449-50ac-bb1c-11784d7421c3",
      "to": "topic:science-research",
      "type": "MENTIONS"
    }
  ],
  "episode_id": "15a1cbea-1449-50ac-bb1c-11784d7421c3",
  "extraction": {
    "extracted_at": "2026-09-23T12:00:00",
    "model_version": "provider:synthetic-validation-corpus-v1",
    "transcript_ref": "transcripts/p08_e01.txt"
  },
  "nodes": [
    {
      "id": "episode:15a1cbea-1449-50ac-bb1c-11784d7421c3",
      "properties": {
        "podcast_id": "sha256:c5df4ffdf9a45b0c75fbcf3b416e78ac14f7a8af21d0155471f55502c7c01bcc",
        "publish_date": "2026-09-23T12:00:00",
        "title": "Public Hour \u2014 Episode 1"
      },
      "type": "Episode"
    },
    {
      "id": "topic:public-radio",
      "properties": {
        "label": "public radio",
        "slug": "public-radio"
      },
      "type": "Topic"
    },
    {
      "id": "topic:broadcast-format",
      "properties": {
        "label": "broadcast format",
        "slug": "broadcast-format"
      },
      "type": "Topic"
    },
    {
      "id": "topic:journalism",
      "properties": {
        "label": "journalism",
        "slug": "journalism"
      },
      "type": "Topic"
    },
    {
      "id": "topic:reliability",
      "properties": {
        "label": "reliability",
        "slug": "reliability"
      },
      "type": "Topic"
    },
    {
      "id": "topic:environment",
      "properties": {
        "label": "environment",
        "slug": "environment"
      },
      "type": "Topic"
    },
    {
      "id": "topic:technology",
      "properties": {
        "label": "technology",
        "slug": "technology"
      },
      "type": "Topic"
    },
    {
      "id": "topic:science-research",
      "properties": {
        "label": "Science & research",
        "slug": "science-research"
      },
      "type": "Topic"
    }
  ],
  "schema_version": "2.0"
}
