{
  "edges": [
    {
      "from": "episode:ep-bccfce5798a83a6e",
      "to": "topic:personal-finance",
      "type": "MENTIONS"
    },
    {
      "from": "episode:ep-bccfce5798a83a6e",
      "to": "topic:risk-management",
      "type": "MENTIONS"
    },
    {
      "from": "episode:ep-bccfce5798a83a6e",
      "to": "topic:lifelong-learning",
      "type": "MENTIONS"
    },
    {
      "from": "episode:ep-bccfce5798a83a6e",
      "to": "topic:expert-interviews",
      "type": "MENTIONS"
    },
    {
      "from": "episode:ep-bccfce5798a83a6e",
      "to": "person:nora",
      "type": "MENTIONS"
    },
    {
      "from": "episode:ep-bccfce5798a83a6e",
      "to": "person:daniel-cho",
      "type": "MENTIONS"
    }
  ],
  "episode_id": "ep-bccfce5798a83a6e",
  "extraction": {
    "extracted_at": "2024-09-06T12:00:00",
    "model_version": "provider:synthetic-validation-corpus-v1",
    "transcript_ref": "transcripts/p05_e01.txt"
  },
  "nodes": [
    {
      "id": "episode:ep-bccfce5798a83a6e",
      "properties": {
        "podcast_id": "p05",
        "publish_date": "2024-09-06T12:00:00",
        "title": "Index Investing Without the Myths"
      },
      "type": "Episode"
    },
    {
      "id": "topic:personal-finance",
      "properties": {
        "label": "personal finance",
        "slug": "personal-finance"
      },
      "type": "Topic"
    },
    {
      "id": "topic:risk-management",
      "properties": {
        "label": "risk management",
        "slug": "risk-management"
      },
      "type": "Topic"
    },
    {
      "id": "topic:lifelong-learning",
      "properties": {
        "label": "lifelong learning",
        "slug": "lifelong-learning"
      },
      "type": "Topic"
    },
    {
      "id": "topic:expert-interviews",
      "properties": {
        "label": "expert interviews",
        "slug": "expert-interviews"
      },
      "type": "Topic"
    },
    {
      "id": "person:nora",
      "properties": {
        "name": "Nora",
        "role": "host"
      },
      "type": "Person"
    },
    {
      "id": "person:daniel-cho",
      "properties": {
        "name": "Daniel Cho",
        "role": "guest"
      },
      "type": "Person"
    }
  ],
  "schema_version": "2.0"
}
