{
  "edges": [
    {
      "from": "episode:5250652d-f8da-5799-91da-8b1ce4991232",
      "to": "topic:public-radio",
      "type": "MENTIONS"
    },
    {
      "from": "episode:5250652d-f8da-5799-91da-8b1ce4991232",
      "to": "topic:journalism",
      "type": "MENTIONS"
    },
    {
      "from": "episode:5250652d-f8da-5799-91da-8b1ce4991232",
      "to": "topic:pronunciation",
      "type": "MENTIONS"
    },
    {
      "from": "episode:5250652d-f8da-5799-91da-8b1ce4991232",
      "to": "topic:reliability",
      "type": "MENTIONS"
    },
    {
      "from": "episode:5250652d-f8da-5799-91da-8b1ce4991232",
      "to": "topic:environment",
      "type": "MENTIONS"
    },
    {
      "from": "episode:5250652d-f8da-5799-91da-8b1ce4991232",
      "to": "topic:technology",
      "type": "MENTIONS"
    }
  ],
  "episode_id": "5250652d-f8da-5799-91da-8b1ce4991232",
  "extraction": {
    "extracted_at": "2026-09-21T12:00:00",
    "model_version": "provider:synthetic-validation-corpus-v1",
    "transcript_ref": "transcripts/p08_e02.txt"
  },
  "nodes": [
    {
      "id": "episode:5250652d-f8da-5799-91da-8b1ce4991232",
      "properties": {
        "podcast_id": "sha256:c5df4ffdf9a45b0c75fbcf3b416e78ac14f7a8af21d0155471f55502c7c01bcc",
        "publish_date": "2026-09-21T12:00:00",
        "title": "Public Hour \u2014 Episode 2"
      },
      "type": "Episode"
    },
    {
      "id": "topic:public-radio",
      "properties": {
        "label": "public radio",
        "slug": "public-radio"
      },
      "type": "Topic"
    },
    {
      "id": "topic:journalism",
      "properties": {
        "label": "journalism",
        "slug": "journalism"
      },
      "type": "Topic"
    },
    {
      "id": "topic:pronunciation",
      "properties": {
        "label": "pronunciation",
        "slug": "pronunciation"
      },
      "type": "Topic"
    },
    {
      "id": "topic:reliability",
      "properties": {
        "label": "reliability",
        "slug": "reliability"
      },
      "type": "Topic"
    },
    {
      "id": "topic:environment",
      "properties": {
        "label": "environment",
        "slug": "environment"
      },
      "type": "Topic"
    },
    {
      "id": "topic:technology",
      "properties": {
        "label": "technology",
        "slug": "technology"
      },
      "type": "Topic"
    }
  ],
  "schema_version": "2.0"
}
